{"$id":"https://jeden.dev/schema/eval-dataset-v1.json","$schema":"https://json-schema.org/draft/2020-12/schema","additionalProperties":false,"properties":{"cases":{"items":{"additionalProperties":false,"properties":{"allowedCapabilities":{"items":{"type":"string"},"type":"array","uniqueItems":true},"budget":{"additionalProperties":false,"properties":{"maxCostMicrounits":{"minimum":0,"type":"integer"},"maxElapsedMs":{"minimum":0,"type":"integer"},"maxInputTokens":{"minimum":0,"type":"integer"},"maxOutputTokens":{"minimum":0,"type":"integer"},"maxSteps":{"minimum":0,"type":"integer"},"maxToolCalls":{"minimum":0,"type":"integer"}},"required":["maxSteps","maxToolCalls","maxInputTokens","maxOutputTokens","maxCostMicrounits","maxElapsedMs"],"type":"object"},"expectedArtifacts":{"items":{"additionalProperties":false,"properties":{"path":{"minLength":1,"type":"string"},"sha256":{"pattern":"^[0-9a-f]{64}$","type":"string"}},"required":["path","sha256"],"type":"object"},"type":"array"},"fixture":{"minLength":1,"type":"string"},"forbiddenActions":{"items":{"type":"string"},"type":"array","uniqueItems":true},"graders":{"items":{"properties":{"hard":{"type":"boolean"},"id":{"minLength":1,"type":"string"},"kind":{"enum":["fileEquals","fileContains","fileAbsent","jsonEquals","jsonSchema","process","artifactSha256"]},"points":{"minimum":1,"type":"integer"}},"required":["kind","id","points","hard"],"type":"object"},"minItems":1,"type":"array"},"id":{"minLength":1,"type":"string"},"license":{"enum":["Apache-2.0","MIT","CC0-1.0"]},"prompt":{"minLength":1,"type":"string"},"provenance":{"minLength":1,"type":"string"},"requiredCapabilities":{"items":{"type":"string"},"type":"array","uniqueItems":true},"seed":{"minimum":1,"type":"integer"},"tags":{"items":{"type":"string"},"type":"array","uniqueItems":true}},"required":["id","fixture","prompt","allowedCapabilities","requiredCapabilities","budget","graders","expectedArtifacts","forbiddenActions","tags","seed","provenance","license"],"type":"object"},"maxItems":50,"minItems":20,"type":"array"},"id":{"minLength":1,"type":"string"},"license":{"enum":["Apache-2.0","MIT","CC0-1.0"]},"provenance":{"minLength":1,"type":"string"},"schema":{"const":"jeden.eval-dataset.v1"},"version":{"minLength":1,"type":"string"}},"required":["schema","id","version","license","provenance","cases"],"title":"Jeden EvalDatasetV1","type":"object"}
