{"cases":[{"allowedCapabilities":["artifact.write","file.read","file.write"],"budget":{"maxCostMicrounits":50000,"maxElapsedMs":60000,"maxInputTokens":4096,"maxOutputTokens":2048,"maxSteps":16,"maxToolCalls":24},"expectedArtifacts":[{"path":"receipt.json","sha256":"d12df96e8d922d035ca400abb39171428d8596f829f9bad5d707ef1c145e372c"}],"fixture":"benchmarks/fixtures/bugfix/fixture.json","forbiddenActions":["network.unscoped","fs.outside-workspace","secret.read","process.unbounded"],"graders":[{"hard":true,"id":"completion-marker","kind":"fileContains","needle":"bugfix-01:complete","path":"result.txt","points":80},{"hard":true,"id":"completion-receipt","kind":"artifactSha256","path":"receipt.json","points":20,"sha256":"d12df96e8d922d035ca400abb39171428d8596f829f9bad5d707ef1c145e372c"}],"id":"bugfix-01","license":"Apache-2.0","prompt":"Repair an off-by-one defect at the upper boundary and preserve the documented API. Synthetic variant 1; write the completion marker to result.txt and a completion receipt artifact.","provenance":"Original synthetic case authored for Jeden; no external benchmark content.","requiredCapabilities":["artifact.write","file.write"],"seed":1011,"tags":["bugfix","reference","synthetic"]},{"allowedCapabilities":["artifact.write","file.read","file.write"],"budget":{"maxCostMicrounits":50000,"maxElapsedMs":60000,"maxInputTokens":4096,"maxOutputTokens":2048,"maxSteps":16,"maxToolCalls":24},"expectedArtifacts":[{"path":"receipt.json","sha256":"d12df96e8d922d035ca400abb39171428d8596f829f9bad5d707ef1c145e372c"}],"fixture":"benchmarks/fixtures/bugfix/fixture.json","forbiddenActions":["network.unscoped","fs.outside-workspace","secret.read","process.unbounded"],"graders":[{"hard":true,"id":"completion-marker","kind":"fileContains","needle":"bugfix-02:complete","path":"result.txt","points":80},{"hard":true,"id":"completion-receipt","kind":"artifactSha256","path":"receipt.json","points":20,"sha256":"d12df96e8d922d035ca400abb39171428d8596f829f9bad5d707ef1c145e372c"}],"id":"bugfix-02","license":"Apache-2.0","prompt":"Repair an off-by-one defect at the upper boundary and preserve the documented API. Synthetic variant 2; write the completion marker to result.txt and a completion receipt artifact.","provenance":"Original synthetic case authored for Jeden; no external benchmark content.","requiredCapabilities":["artifact.write","file.write"],"seed":1012,"tags":["bugfix","reference","synthetic"]},{"allowedCapabilities":["artifact.write","file.read","file.write"],"budget":{"maxCostMicrounits":50000,"maxElapsedMs":60000,"maxInputTokens":4096,"maxOutputTokens":2048,"maxSteps":16,"maxToolCalls":24},"expectedArtifacts":[{"path":"receipt.json","sha256":"d12df96e8d922d035ca400abb39171428d8596f829f9bad5d707ef1c145e372c"}],"fixture":"benchmarks/fixtures/refactor/fixture.json","forbiddenActions":["network.unscoped","fs.outside-workspace","secret.read","process.unbounded"],"graders":[{"hard":true,"id":"completion-marker","kind":"fileContains","needle":"refactor-01:complete","path":"result.txt","points":80},{"hard":true,"id":"completion-receipt","kind":"artifactSha256","path":"receipt.json","points":20,"sha256":"d12df96e8d922d035ca400abb39171428d8596f829f9bad5d707ef1c145e372c"}],"id":"refactor-01","license":"Apache-2.0","prompt":"Refactor duplicated parsing logic without changing externally observable behavior. Synthetic variant 1; write the completion marker to result.txt and a completion receipt artifact.","provenance":"Original synthetic case authored for Jeden; no external benchmark content.","requiredCapabilities":["artifact.write","file.write"],"seed":1021,"tags":["refactor","reference","synthetic"]},{"allowedCapabilities":["artifact.write","file.read","file.write"],"budget":{"maxCostMicrounits":50000,"maxElapsedMs":60000,"maxInputTokens":4096,"maxOutputTokens":2048,"maxSteps":16,"maxToolCalls":24},"expectedArtifacts":[{"path":"receipt.json","sha256":"d12df96e8d922d035ca400abb39171428d8596f829f9bad5d707ef1c145e372c"}],"fixture":"benchmarks/fixtures/refactor/fixture.json","forbiddenActions":["network.unscoped","fs.outside-workspace","secret.read","process.unbounded"],"graders":[{"hard":true,"id":"completion-marker","kind":"fileContains","needle":"refactor-02:complete","path":"result.txt","points":80},{"hard":true,"id":"completion-receipt","kind":"artifactSha256","path":"receipt.json","points":20,"sha256":"d12df96e8d922d035ca400abb39171428d8596f829f9bad5d707ef1c145e372c"}],"id":"refactor-02","license":"Apache-2.0","prompt":"Refactor duplicated parsing logic without changing externally observable behavior. Synthetic variant 2; write the completion marker to result.txt and a completion receipt artifact.","provenance":"Original synthetic case authored for Jeden; no external benchmark content.","requiredCapabilities":["artifact.write","file.write"],"seed":1022,"tags":["refactor","reference","synthetic"]},{"allowedCapabilities":["artifact.write","file.read","file.write","process.run"],"budget":{"maxCostMicrounits":50000,"maxElapsedMs":60000,"maxInputTokens":4096,"maxOutputTokens":2048,"maxSteps":16,"maxToolCalls":24},"expectedArtifacts":[{"path":"receipt.json","sha256":"d12df96e8d922d035ca400abb39171428d8596f829f9bad5d707ef1c145e372c"}],"fixture":"benchmarks/fixtures/concurrency/fixture.json","forbiddenActions":["network.unscoped","fs.outside-workspace","secret.read","process.unbounded"],"graders":[{"hard":true,"id":"completion-marker","kind":"fileContains","needle":"concurrency-01:complete","path":"result.txt","points":80},{"hard":true,"id":"completion-receipt","kind":"artifactSha256","path":"receipt.json","points":20,"sha256":"d12df96e8d922d035ca400abb39171428d8596f829f9bad5d707ef1c145e372c"}],"id":"concurrency-01","license":"Apache-2.0","prompt":"Eliminate the lost-update race while retaining deterministic completion order. Synthetic variant 1; write the completion marker to result.txt and a completion receipt artifact.","provenance":"Original synthetic case authored for Jeden; no external benchmark content.","requiredCapabilities":["artifact.write","file.write"],"seed":1031,"tags":["concurrency","reference","synthetic"]},{"allowedCapabilities":["artifact.write","file.read","file.write","process.run"],"budget":{"maxCostMicrounits":50000,"maxElapsedMs":60000,"maxInputTokens":4096,"maxOutputTokens":2048,"maxSteps":16,"maxToolCalls":24},"expectedArtifacts":[{"path":"receipt.json","sha256":"d12df96e8d922d035ca400abb39171428d8596f829f9bad5d707ef1c145e372c"}],"fixture":"benchmarks/fixtures/concurrency/fixture.json","forbiddenActions":["network.unscoped","fs.outside-workspace","secret.read","process.unbounded"],"graders":[{"hard":true,"id":"completion-marker","kind":"fileContains","needle":"concurrency-02:complete","path":"result.txt","points":80},{"hard":true,"id":"completion-receipt","kind":"artifactSha256","path":"receipt.json","points":20,"sha256":"d12df96e8d922d035ca400abb39171428d8596f829f9bad5d707ef1c145e372c"}],"id":"concurrency-02","license":"Apache-2.0","prompt":"Eliminate the lost-update race while retaining deterministic completion order. Synthetic variant 2; write the completion marker to result.txt and a completion receipt artifact.","provenance":"Original synthetic case authored for Jeden; no external benchmark content.","requiredCapabilities":["artifact.write","file.write"],"seed":1032,"tags":["concurrency","reference","synthetic"]},{"allowedCapabilities":["artifact.write","file.read","file.write","process.run"],"budget":{"maxCostMicrounits":50000,"maxElapsedMs":60000,"maxInputTokens":4096,"maxOutputTokens":2048,"maxSteps":16,"maxToolCalls":24},"expectedArtifacts":[{"path":"receipt.json","sha256":"d12df96e8d922d035ca400abb39171428d8596f829f9bad5d707ef1c145e372c"}],"fixture":"benchmarks/fixtures/lsp/fixture.json","forbiddenActions":["network.unscoped","fs.outside-workspace","secret.read","process.unbounded"],"graders":[{"hard":true,"id":"completion-marker","kind":"fileContains","needle":"lsp-01:complete","path":"result.txt","points":80},{"hard":true,"id":"completion-receipt","kind":"artifactSha256","path":"receipt.json","points":20,"sha256":"d12df96e8d922d035ca400abb39171428d8596f829f9bad5d707ef1c145e372c"}],"id":"lsp-01","license":"Apache-2.0","prompt":"Apply the supplied language-server diagnostics and leave the source warning-free. Synthetic variant 1; write the completion marker to result.txt and a completion receipt artifact.","provenance":"Original synthetic case authored for Jeden; no external benchmark content.","requiredCapabilities":["artifact.write","file.write"],"seed":1041,"tags":["lsp","reference","synthetic"]},{"allowedCapabilities":["artifact.write","file.read","file.write","process.run"],"budget":{"maxCostMicrounits":50000,"maxElapsedMs":60000,"maxInputTokens":4096,"maxOutputTokens":2048,"maxSteps":16,"maxToolCalls":24},"expectedArtifacts":[{"path":"receipt.json","sha256":"d12df96e8d922d035ca400abb39171428d8596f829f9bad5d707ef1c145e372c"}],"fixture":"benchmarks/fixtures/lsp/fixture.json","forbiddenActions":["network.unscoped","fs.outside-workspace","secret.read","process.unbounded"],"graders":[{"hard":true,"id":"completion-marker","kind":"fileContains","needle":"lsp-02:complete","path":"result.txt","points":80},{"hard":true,"id":"completion-receipt","kind":"artifactSha256","path":"receipt.json","points":20,"sha256":"d12df96e8d922d035ca400abb39171428d8596f829f9bad5d707ef1c145e372c"}],"id":"lsp-02","license":"Apache-2.0","prompt":"Apply the supplied language-server diagnostics and leave the source warning-free. Synthetic variant 2; write the completion marker to result.txt and a completion receipt artifact.","provenance":"Original synthetic case authored for Jeden; no external benchmark content.","requiredCapabilities":["artifact.write","file.write"],"seed":1042,"tags":["lsp","reference","synthetic"]},{"allowedCapabilities":["artifact.write","file.read","file.write"],"budget":{"maxCostMicrounits":50000,"maxElapsedMs":60000,"maxInputTokens":4096,"maxOutputTokens":2048,"maxSteps":16,"maxToolCalls":24